product_id,product_name,category,discounted_price,actual_price,discount_percentage,rating,rating_count,about_product,user_id,user_name,review_id,review_title,review_content,img_link,product_link,categories,Tags
B09ZHCJDP1,"Amazon Basics Wireless Mouse | 2.4 GHz Connection, 1600 DPI | Type - C Adapter | Upto 12 Months of Battery Life | Ambidextrous Design | Suitable for PC/Mac/Laptop","computers, accessories, mice",499.0,1.0,0.5,5.0,23.0,"reliable, wireless, connection, optical, tracking, ultra, precise, movement, surface, 3, switchable, dpi, modes, performance, material, rubber, wheel, offers, noise, reduction, click, feel, standard, plug, forget, setup, windows, mac, chrome, os, linux, comes, type, c, adapter, additional, 12, months, battery, life, smart, sleep, mode, switch, conserve, power, comes, 1, aa, design, greater, comfort, precision, size, makes, easy, carry","AFLLEPVLIAH2DFSHAZ77KWFM72ZA,AHY2YZWK63CNZ626MC3TFQRBB7RA,AG3PG2EM3MIT6IYPS5KZRIAF4QDQ,AE2KS6ZY376YMGX7RNKV7VXUEGFQ,AHUPZTSAPO7GABNBTIBDYNFKYFKQ,AENQGQZ4L2CTB7HT4QUUZB3IJO6A,AFZDZGWHZNPZ3VLECIBYSFUDGT4A,AGOYRUEHDI3SH7N4KBLQS4KE6G2A","Rambeer kumar,Ramesh,Digambar Shelke,awadhesh Kumar,Agrim Shamra,mahima,harpreet singh,Rajat Semwal","R76XPXMKXLWKH,R23S77AWPH5FP5,RK7Q6W5FOPESC,R2X5K6OCG1KJ3I,R27S1KARCAPY6C,R25RJ35CXQYW5C,R1ASXFOSQ5BCR7,R3UZGGP0USHERY","responsive, stylish, mouse, simply, awesome, satisfactory, otg, working, satisfied, wireless, mouse, overall, performance, good, happy, product, strong, build, silent, click, excellent, mouse, price","I really like this wireless mouse it has became my daily driver. The connection is instant and fast. The mouse is super comfortable in my hand. The click is easy and perfect feel. Very responsive and the look is stylish and compact.,I bought this wireless mouse because of its compact form factor. It can be carried easily in laptop bag avoiding and hump forming in bag. Product built is sturdy. Scroll wheel is smooth.,The mouse is as per my expectations and really it's working smoothly and not making a tik sound like any other mouse. OTG given with the mouse is not working.,I found this product extremely user friendly and satisfactory. The mouse is perfectly designed and provides an excellent grip. The sensitivity is calibrated to the finest. Comes with silent click feature.,This mouse is really working very well the quality and the speed of the pointer mouse is very accurate and coming to distance it even works from very long distance.,It is flawless and very nice to use and hold. Initially, I think it will take sometime to get used to the size and shape of the Mouse, but after that, its very smooth. Also, it is very silent,Best mouse in this price range Built quality is so good. Response time is so amazing. Overall very happy  with the product.,Excellent mouse for this price. Felt its far better than HP Logitech Zebronics and Dell wireless mouse as i have used all of the above",https://m.media-amazon.com/images/I/31+Rg6Z46dL._SX300_SY300_.jpg,https://www.amazon.in/Wireless-Connection-Battery-Ambidextrous-Suitable/dp/B09ZHCJDP1/ref=sr_1_209?qid=1672903005&s=computers&sr=1-209,Computers&Accessories,"computers, accessories, mice, reliable, wireless, connection, optical, tracking, ultra, precise, movement, surface, 3, switchable, dpi, modes, performance, material, rubber, wheel, offers, noise, reduction, click, feel, standard, plug, forget, setup, windows, mac, chrome, os, linux, comes, type, c, adapter, additional, 12, months, battery, life, smart, sleep, mode, switch, conserve, power, comes, 1, aa, design, greater, comfort, precision, size, makes, easy, carry, responsive, stylish, mouse, simply, awesome, satisfactory, otg, working, satisfied, wireless, mouse, overall, performance, good, happy, product, strong, build, silent, click, excellent, mouse, price"
B0BP7XLX48,"Syncwire LTG to USB Cable for Fast Charging Compatible with Phone 5/ 5C/ 5S/ 6/ 6S/ 7/8/ X/XR/XS Max/ 11/12/ 13 Series and Pad Air/Mini, Pod & Other Devices (1.1 Meter, White)","computers, accessories, usbcables",399.0,1.999,0.8,5.0,5.0,"sturdy, durable, cable, tpe, premium, copper, protects, bending, data, transfer, speed, 480, mbps, built, safety, protections, core, copper, wires, promoting, maximum, signal, tested, bending, ranges, 18k, 20k, bends, making, durable, 3d, aluminium, connector, laser, welding, technology, hard, break, fits, giving, good, connectivity, phone, charger, office, home, travelling, easily, foldable, n, fitted, pocket, cable, comes, charging, data, sync, cable, unique, terms, design, multi, use, positioned, provide, best, comfort, performance, sync, charge, sync, simultaneously, rapid, speed, compatible, charging, adaptor, multi, port, charging, station, power, bank","AF7EOXYL5K36BDP6PXF6K2TL5TPA,AEN7NV2P5WNHM7EXCWWWES43N3PQ,AFFCNMMFC5VPKDGX5FGNODAS6Z6Q,AFQJM63Q7OMAP62BP3TB4YQEZAXA,AGN5DA5YJ2ZNRT47PCFQTDEDEHNQ","Amazon Customer,kamal sahota,Pankaj,luvsmplcty,kanta","R1L2JNO4Y3BHYF,R2346F22YLZ9IG,R3A4GAQTCPE5U7,R2ATN54F3RWETQ,RGINUSORDHO9N","good, superb, quality, good, products, nice, working, rely, companys, products, good, thank","Product is good in quality. Working good with my i phone 7.,Good quality and really fast charging and packing is also like original one worth product,Good product and good quality,Working well with iphone11.,",https://m.media-amazon.com/images/I/317OoQfs1gL._SX300_SY300_QL70_FMwebp_.jpg,https://www.amazon.in/Syncwire-Cable-Charging-Compatible-Devices/dp/B0BP7XLX48/ref=sr_1_194?qid=1672909134&s=electronics&sr=1-194,Computers&Accessories,"computers, accessories, usbcables, sturdy, durable, cable, tpe, premium, copper, protects, bending, data, transfer, speed, 480, mbps, built, safety, protections, core, copper, wires, promoting, maximum, signal, tested, bending, ranges, 18k, 20k, bends, making, durable, 3d, aluminium, connector, laser, welding, technology, hard, break, fits, giving, good, connectivity, phone, charger, office, home, travelling, easily, foldable, n, fitted, pocket, cable, comes, charging, data, sync, cable, unique, terms, design, multi, use, positioned, provide, best, comfort, performance, sync, charge, sync, simultaneously, rapid, speed, compatible, charging, adaptor, multi, port, charging, station, power, bank, good, superb, quality, good, products, nice, working, rely, companys, products, good, thank"
B0BR4F878Q,"Swiffer Instant Electric Water Heater Faucet Tap Home-Kitchen Instantaneous Water Heater Tank less for Tap, LED Electric Head Water Heaters Tail Gallon Comfort(3000W) ((Pack of 1))","home, kitchen, instantwaterheaters",1.439,1.999,0.28,4.8,53.803,"quick, electric, hot, water, tap, heating, tube, high, purity, copper, liner, heating, element, rated, voltage, rated, power, receive, swiffer, water, tankless, instant, electric, tap, water, heater, test, hands, need, install, test, dangerous, operate, according, support, dual, use, electric, faucet, heated, water, lower, temperature, smaller, flow, higher, power, unified, 3000, watt, 5, seconds, fast, heat, hands, wo, feel, cold, washing, dishes, laundry, washing, vegetables, course, washing, face, brushing, teeth, warm, water, morning, great, hands, wo, feel, cold, washing, dishes, laundry, course, washing, face, brushing, teeth, warm, water, morning, great, receive, water, heater, test, hands, need, install, test, dangerous, operate, according, brand, new, high, quality, surface, treatment, polished, installation, type, deck, mounted, number, handles, single, mode, water, heater, tankless, water, heater, electric, heats, flow, passing, degrees, celsius, temperature, takes, 5, seconds, heat, water, heated, water, temperature, 30, 40, degrees, winter, 30, 60, degrees, summer","AEU7DVFEL43XZ6T4D572W2ZLBRKQ,AGWOH7CFDMUVW52NMZWQBKBNNQOA,AGZN422FGG7JO3T5YY6IVUELOODA","Yogita g.,Amazon Customer,Mimsy","R2WHW4PEF14WOD,R2DCCZWUGI0O0K,R1FA1HH6VL1RAL","best, product, expansive, works, upto, 800sqft, area, great, product","Must buy best Fabulous product I recommend this👍👍,For small place it’s gud,A great product. Works wonders on my vitrified tile floors.",https://m.media-amazon.com/images/I/41+t2HWvwFL._SY300_SX300_.jpg,https://www.amazon.in/Swiffer-Instant-Electric-Home-Kitchen-Instantaneous/dp/B0BR4F878Q/ref=sr_1_150?qid=1672923597&s=kitchen&sr=1-150,Home&Kitchen,"home, kitchen, instantwaterheaters, quick, electric, hot, water, tap, heating, tube, high, purity, copper, liner, heating, element, rated, voltage, rated, power, receive, swiffer, water, tankless, instant, electric, tap, water, heater, test, hands, need, install, test, dangerous, operate, according, support, dual, use, electric, faucet, heated, water, lower, temperature, smaller, flow, higher, power, unified, 3000, watt, 5, seconds, fast, heat, hands, wo, feel, cold, washing, dishes, laundry, washing, vegetables, course, washing, face, brushing, teeth, warm, water, morning, great, hands, wo, feel, cold, washing, dishes, laundry, course, washing, face, brushing, teeth, warm, water, morning, great, receive, water, heater, test, hands, need, install, test, dangerous, operate, according, brand, new, high, quality, surface, treatment, polished, installation, type, deck, mounted, number, handles, single, mode, water, heater, tankless, water, heater, electric, heats, flow, passing, degrees, celsius, temperature, takes, 5, seconds, heat, water, heated, water, temperature, 30, 40, degrees, winter, 30, 60, degrees, summer, best, product, expansive, works, upto, 800sqft, area, great, product"
B0BQ3K23Y1,"Oratech Coffee Frother electric, milk frother electric, coffee beater, cappuccino maker, Coffee Foamer, Mocktail Mixer, Coffee Foam Maker, coffee whisker electric, Froth Maker, coffee stirrers electric, coffee frothers, Coffee Blender, (6 Month Warranty) (Multicolour)","home, kitchen, handblenders",279.0,499.0,0.44,4.8,28.0,"delicious, milk, foam, creamer, drinks, home, trip, starbucks, coffee, maker, milk, frother, benefits, having, electric, cold, coffee, maker, endless, best, coffee, know, tastes, trusted, quality, use, premium, materials, milk, frother, coffee, rust, break, built, clean, coffee, frother, electric, durable, convenient, metal, stand, gives, easy, access, foaming, milk, seconds, cleanup, portable, coffee, maker, faster, clean, coffee, mixer, blender, hot, running, water, briefly, turn, instantly, coffee, frother, works, better, manual, coffee, hand, blender, making, matcha, tea, works, far, better, fork, frother, coffee, works, mix, nutritious, protein, powder, drinks, extra, container, blender, bottle, shaker, wash, use, mocktail, mixer, whisking, mixing, coffee, beater, comes, elegant, design, fit, modern, requires, aa, double, batteries, start, batteries, included","AGRJZJKWKIE573KM5FWPOH4F7YCA,AEHV4VOLDQX5XYA42OZHALYA3USA,AHOZBF2VFWS62WO3XJT73NHAPQMA,AECYWFZ53SIMOPOKAILDW3VNGRRA,AHGAALVLOMKMYOG4JAJALWFSHLCA,AG6EGJADJ2KCEGGKRPKY2B4MAJMA,AGVVZWV4QHKHNWI7FT3ENKKKBCHA,AHIRZ7N53BSLWFWNEUWYKT6NH6OQ","Amazon Customer,Neha Mehta,Nischal Agarwal,tharangini reddy,Mohammad Salim,Ak,suyesh v.,Kiran ahuja","R3907SDNN9VR5Y,R1NNMXA39722T8,RXQNT49DKJ26S,R22MNVNS4IIKG3,R2CQDP0G85P8C0,RMJZ65KLW040B,R2M6EZZQ3RC4AX,RLWCOK6XMDAGC","oratech, best, coffee, frother, great, review, oratech, coffee, frother, milk, good, product, easy, use, good, product, best, product, easy, use","Overall, I love this Oratech Coffee frother and have used it soooo many times since purchasing it. I mostly use it to make whipped coffee but I've also used it for mixing protein powder in milk and frothing milk / creamer for coffee.It is incredible effective for exclusively liquid substances like milk and creamer; I realized this after over-frothing my creamer one morning to the point of pure foam lol. After that I kept it in mind and I know to only do it for a short amount of time. Super easy to use, versatile in what it can be used for (as far as liquids go), and tbh it just looks really cute on the coffee-making section of my counter. The stand is a hugeeee plus, I definitely wouldn't purchase an alternative option without one.It gets the job done for whipped coffee.I also use this product to blend my matcha powder and my turmeric-cinnamon-ginger-coconut milk powder lattes. This frother takes out all the lumps and bumps. Because the resulting blend is smooth, it does not waste the ingredients like stirring with a spoon. So, so great! It has made my favorites even more practical and delicious. I have not found anything about this product that I do not like. I would recommend this product to others and have already done so. Get it! You will be pleased. It is the best Coffee Beater.,I really liked this coffee frother. With its help I am making Cappuccino Latte at home easily. Easy to clean also.,This oratech coffee frother makes coffee game easier and fun.After using it for a week. I’m sharing its pros and consPros:1. Frothing milk for coffee is easier and fun with Oratech Coffee Beater.2. Material quality is good.3. It is portable so you can use it anywhere.4. It is small so you can keep it anywhere.Cons:1. Frothing heavy liquid is tough.My overall feeling about this product is it you are coffee lover and you want to make foamy coffee. It is best for you.,Best quality product. Easy to use and easy to clean. Best coffee frother and easy to coffee making. I loved this product.,This product is easy to use, durable and helps in blending quickly.,Such a good product and enjoying to make coffee and handy too.👍😊😊,Best milk frother for coffeeIt is easy to use.,Every coffee lover must try this electric coffee frother",https://m.media-amazon.com/images/W/WEBP_402378-T2/images/I/41t3WVUlRmL._SX300_SY300_QL70_FMwebp_.jpg,https://www.amazon.in/Oratech-electric-cappuccino-Mocktail-Multicolour/dp/B0BQ3K23Y1/ref=sr_1_216?qid=1672923601&s=kitchen&sr=1-216,Home&Kitchen,"home, kitchen, handblenders, delicious, milk, foam, creamer, drinks, home, trip, starbucks, coffee, maker, milk, frother, benefits, having, electric, cold, coffee, maker, endless, best, coffee, know, tastes, trusted, quality, use, premium, materials, milk, frother, coffee, rust, break, built, clean, coffee, frother, electric, durable, convenient, metal, stand, gives, easy, access, foaming, milk, seconds, cleanup, portable, coffee, maker, faster, clean, coffee, mixer, blender, hot, running, water, briefly, turn, instantly, coffee, frother, works, better, manual, coffee, hand, blender, making, matcha, tea, works, far, better, fork, frother, coffee, works, mix, nutritious, protein, powder, drinks, extra, container, blender, bottle, shaker, wash, use, mocktail, mixer, whisking, mixing, coffee, beater, comes, elegant, design, fit, modern, requires, aa, double, batteries, start, batteries, included, oratech, best, coffee, frother, great, review, oratech, coffee, frother, milk, good, product, easy, use, good, product, best, product, easy, use"
B0B53DS4TF,"Instant Pot Air Fryer, Vortex 2QT, Touch Control Panel, 360° EvenCrisp™ Technology, Uses 95 % less Oil, 4-in-1 Appliance: Air Fry, Roast, Bake, Reheat (Vortex 1.97Litre, Black)","home, kitchen, airfryers",4.995,20.049,0.75,4.8,3.964,"voltage, 230, volts, instant, vortex, air, fryer, litre, designed, indian, electrical, power, 230, v, 50, home, installation, free, home, service, instant, brands, committed, customers, interest, ahead, feel, free, contact, customer, care, 1800, 123, 2700, demonstration, installation, service, functionality, air, fry, roast, bake, possibilities, french, fries, samosas, kabab, cutlet, chicken, nuggets, corn, cheese, balls, banana, chips, cakes, muffins, free, food, 95, oil, evencrisp, technology, instant, air, fryer, delivers, crunch, tenderness, deep, frying, 95, technology, advanced, technology, drives, air, flow, perfect, golden, finish, crispy, tender, results, touch, digital, panel, digital, touch, panel, consists, 6, cooking, functions, air, fry, broil, roast, dehydrate, reheat, bake, cooking, time, temperature, settings","AGXJAYXZKJ6NCPSLX57MXJLQ3F6Q,AEQYSJWBP6DN2IV2LDP4XVNI4FBQ,AGNHWTOCLPVNZ56CWEF3QQI25ROA,AHC4JPWEXYM3O4YAKYIJZ5CAUOVQ,AECXWRKH4W4B73UW5IAHDTBZYTBQ,AEU6W4IG5BLXZ5XJ23PYFQKXYHSA,AGY4IRMJHF35GY44YCTUVQAEIJ2Q,AHVMCHCWTUWBKE4WYBY27MBIQ32A","nikhil,Rituja Ray,Prasan Krishnan Karthikeyan,Amazon Customer,Georgy Mathew,Vikas Kakkar,KANNAN P,Placeholder","R2FHIBV8JE4CTB,R315K0BCU0KVKO,RD129PA7KQQOR,R3BTQPGZLTN48E,RH0STL2LKD7N5,RVNS9SRGUWUT3,R25CXUY1Y74QGF,R1SIGI0M0INPVB","loved, good, product, good, product, easy, use, product, awesome, product, nice, product, user, friendly, correct, size, easy, use","I have used multiple air fryers. But this one is best and value for money,Good product and a excellent demo was given by Manikandan on video call.However we returned this to get a higher version of this.,It's a good product, worth the money. The virtual installation and demo given by Manikandan was very helpful and made it easy to use.,Easy to use. Easy to clean. Easy to maintain. Good product. Value for money must recommend to everyone. Thanks a lot.,This airfryer as expected is an alternative for people who hate deep frying and oil less food. Not only that Instant pot could be better than other airfryers out in the market.Manikandan gave a demo of the product. Thank you,Very Good explanation about product and it's function then  safety precautions and clarify our doubts by Manikandan and this demo was very useful to us.,Nice product & user friendly, got video session for demo & installation given today by Zafar. He explained all the options very well & ready to support even after demo. I am giving 5 star for product & installation.,This Airfryer is most satisfying,compact,not over sized and easy to clean.I was worried it will be too large.worth the cost.",https://m.media-amazon.com/images/W/WEBP_402378-T1/images/I/313WfOy8VSL._SX300_SY300_QL70_FMwebp_.jpg,https://www.amazon.in/Instant-Vortex-2QT-EvenCrispTM-Technology/dp/B0B53DS4TF/ref=sr_1_316?qid=1672923609&s=kitchen&sr=1-316,Home&Kitchen,"home, kitchen, airfryers, voltage, 230, volts, instant, vortex, air, fryer, litre, designed, indian, electrical, power, 230, v, 50, home, installation, free, home, service, instant, brands, committed, customers, interest, ahead, feel, free, contact, customer, care, 1800, 123, 2700, demonstration, installation, service, functionality, air, fry, roast, bake, possibilities, french, fries, samosas, kabab, cutlet, chicken, nuggets, corn, cheese, balls, banana, chips, cakes, muffins, free, food, 95, oil, evencrisp, technology, instant, air, fryer, delivers, crunch, tenderness, deep, frying, 95, technology, advanced, technology, drives, air, flow, perfect, golden, finish, crispy, tender, results, touch, digital, panel, digital, touch, panel, consists, 6, cooking, functions, air, fry, broil, roast, dehydrate, reheat, bake, cooking, time, temperature, settings, loved, good, product, good, product, easy, use, product, awesome, product, nice, product, user, friendly, correct, size, easy, use"
B0BLC2BYPX,"Zuvexa USB Rechargeable Electric Foam Maker - Handheld Milk Wand Mixer Frother for Hot Milk, Hand Blender Coffee, Egg Beater (Black)","home, kitchen, handblenders",499.0,1.299,0.62,4.7,54.0,"food, taste, stainless, steel, whisking, head, removable, simple, clean, frother, wand, easy, pleasant, grip, constructed, food, grade, abs, internal, strong, low, noise, motor, increases, rotation, speed, upsetting, family, giving, peaceful, 2, interchangeable, multipurpose, whisks, available, create, ideal, milk, foam, morning, afternoon, coffee, use, spring, whisking, head, additionally, balloon, whisking, head, aids, beating, eggs, light, whipped, built, 1200mah, rechargeable, lithium, battery, powers, portable, milk, frother, eliminating, need, additional, batteries, saving, money, additionally, simple, android, usb, cable, takes, 6, hours, completely, charge, activate, blue, light, coffee, frother, press, switch, pressing, button, speed, alternate, low, medium, high, best, frother, effect, pick, variety, speeds, strong, motor, frother, tall, bottle, deeper, container, prevent, coffee, milk, mixing, pulse, technology, noisy, robust, milk, foam, maker, stylishly, designed, black, blend, kitchen, appear, sophisticated, turn, simply, push, button, foam, coffee, types, milks, cream, cappuccinos, matcha, lattes, hot, chocolate, ease","AG6AS2KLLZMPPPEKF5RIJXTMA4FA,AEW6BC4YLRYKI5OZGG2TFQSVNPCQ,AGJHYTYSBPEBX6DRHFDVKOPUG3RQ,AHDOOBJBPVJQCWTNVD4L5VIQBBWA,AGXWSSAGJWT437I6SEHW2DBHPAUQ,AHP75RDBGYFPLYD5NVTHZMNJUOAQ,AFBWWOUHEYFHDWJOE42DN5YWO2MQ,AHHRYTCXJYJCRHFUK2EPOG7I3CHQ","shammi,Rippy Mittal,Kabeer,Kush,Vani Prabha,neha,Reena Chahar,Rameshwar","R1M11VMLH6I3TN,R2OLOOGNHQ37ZA,R3PIVKT8BNMA4G,R3IEB79VMJ4KUB,R2FW55EB4WH4HM,RKHYI4QXIDG0B,RR30YFP5QKZZZ,R13ATADDWQX8CT","little, kitchen, helper, amazing, product, good, product, nice, use, handy, use, carry, great, product, best, product, light, weight, definitely, save, time","The first time I tried it send the eggs and the milk cream all over the kitchen. Big mess so i suggest that you try it with water in a cup or bowl to get the feel of it. Then you will fall in love with this gadget. Easy to clean just rinse under the tap. The charge holds up just about for a job so you don't burn or heat up the motor. Frothing for a cup of coffee or creaming eggs for a fluffy Omelette is easy peasy. Flimsy for ruff use but hey you can't complain for the price your paying.,This is nice for people who wishes for a durable device to blend and whisk their eggs , coffee, milk , etc for a luxurious vibe. Nice as it doesn't operate on battery but electric charge. I feel the price might look steep, but otherwise the product is a 10/10,Good product and easy to use and it very reasonable price I loved this product but it think that they have to increase the capacity of battery power except this all is good,It's a good handy product. Works well and is easy to use. It will definitely make your work in kitchen simpler.,The product was easy to use and reachable in few minutes,Useful product very good 😊,Easy to use excellent,Value for moneyNd easy to use",https://m.media-amazon.com/images/I/41714O1hnmS._SY300_SX300_QL70_FMwebp_.jpg,https://www.amazon.in/Zuvexa-Rechargeable-Electric-Foam-Maker/dp/B0BLC2BYPX/ref=sr_1_243?qid=1672923603&s=kitchen&sr=1-243,Home&Kitchen,"home, kitchen, handblenders, food, taste, stainless, steel, whisking, head, removable, simple, clean, frother, wand, easy, pleasant, grip, constructed, food, grade, abs, internal, strong, low, noise, motor, increases, rotation, speed, upsetting, family, giving, peaceful, 2, interchangeable, multipurpose, whisks, available, create, ideal, milk, foam, morning, afternoon, coffee, use, spring, whisking, head, additionally, balloon, whisking, head, aids, beating, eggs, light, whipped, built, 1200mah, rechargeable, lithium, battery, powers, portable, milk, frother, eliminating, need, additional, batteries, saving, money, additionally, simple, android, usb, cable, takes, 6, hours, completely, charge, activate, blue, light, coffee, frother, press, switch, pressing, button, speed, alternate, low, medium, high, best, frother, effect, pick, variety, speeds, strong, motor, frother, tall, bottle, deeper, container, prevent, coffee, milk, mixing, pulse, technology, noisy, robust, milk, foam, maker, stylishly, designed, black, blend, kitchen, appear, sophisticated, turn, simply, push, button, foam, coffee, types, milks, cream, cappuccinos, matcha, lattes, hot, chocolate, ease, little, kitchen, helper, amazing, product, good, product, nice, use, handy, use, carry, great, product, best, product, light, weight, definitely, save, time"
